{
  "schema": "aether.data-processing.request",
  "request_id": "0190aee6-2139-7a87-8448-806f1b843201",
  "submitted_at": "2026-07-11T12:00:01Z",
  "deadline": "2026-07-11T12:00:06Z",
  "task": {
    "id": "example.signal-forecast",
    "revision": 1,
    "kind": "forecast"
  },
  "binding": {
    "id": "example.edge-asset",
    "revision": 1
  },
  "processor_contract": "aether.data-processing.forecast",
  "artifact": {
    "kind": "model",
    "family": "example-signal",
    "version": "v3"
  },
  "frame": {
    "schema": "aether.processing-frame",
    "as_of": "2026-07-11T12:00:00Z",
    "cadence_seconds": 900,
    "history": {
      "timestamps": [
        "2026-07-11T11:15:00Z",
        "2026-07-11T11:30:00Z",
        "2026-07-11T11:45:00Z",
        "2026-07-11T12:00:00Z"
      ],
      "features": {
        "signal": {
          "value_type": "number",
          "unit": "1",
          "values": [818.0, 820.0, 835.0, 840.0],
          "quality": ["good", "good", "good", "good"]
        },
        "temp_avg": {
          "value_type": "number",
          "unit": "Cel",
          "values": [30.9, 31.0, 31.2, 31.4],
          "quality": ["good", "good", "good", "good"]
        },
        "humidity": {
          "value_type": "number",
          "unit": "%",
          "values": [65.0, 64.0, 63.0, 62.0],
          "quality": ["good", "good", "good", "good"]
        },
        "rain": {
          "value_type": "number",
          "unit": "mm",
          "values": [0.0, 0.0, 0.0, 0.0],
          "quality": ["good", "good", "good", "good"]
        },
        "quarter_hour": {
          "value_type": "number",
          "unit": "1",
          "values": [45, 46, 47, 48],
          "quality": ["good", "good", "good", "good"]
        }
      }
    },
    "future_covariates": {
      "timestamps": [
        "2026-07-11T12:15:00Z",
        "2026-07-11T12:30:00Z"
      ],
      "features": {
        "temp_avg": {
          "value_type": "number",
          "unit": "Cel",
          "values": [32.1, 32.0],
          "quality": ["good", "good"]
        },
        "humidity": {
          "value_type": "number",
          "unit": "%",
          "values": [61.0, 62.0],
          "quality": ["good", "good"]
        },
        "rain": {
          "value_type": "number",
          "unit": "mm",
          "values": [0.0, 0.0],
          "quality": ["good", "good"]
        },
        "quarter_hour": {
          "value_type": "number",
          "unit": "1",
          "values": [49, 50],
          "quality": ["good", "good"]
        }
      }
    },
    "static_features": {},
    "quality": {
      "input_watermark": "2026-07-11T12:00:00Z",
      "missing_ratio": 0.0,
      "max_gap_seconds": 900,
      "live_tail_included": false,
      "substituted_samples": 0
    },
    "provenance": [
      {
        "segment": "history",
        "feature": "signal",
        "source_kind": "history",
        "source_ref": "example.asset.signal",
        "watermark": "2026-07-11T12:00:00Z"
      },
      {
        "segment": "history",
        "feature": "temp_avg",
        "source_kind": "history",
        "source_ref": "weather.observed.air_temperature",
        "watermark": "2026-07-11T12:00:00Z"
      },
      {
        "segment": "history",
        "feature": "humidity",
        "source_kind": "history",
        "source_ref": "weather.observed.relative_humidity",
        "watermark": "2026-07-11T12:00:00Z"
      },
      {
        "segment": "history",
        "feature": "rain",
        "source_kind": "history",
        "source_ref": "weather.observed.precipitation",
        "watermark": "2026-07-11T12:00:00Z"
      },
      {
        "segment": "history",
        "feature": "quarter_hour",
        "source_kind": "calendar",
        "source_ref": "calendar.quarter_hour",
        "watermark": "2026-07-11T12:00:00Z"
      },
      {
        "segment": "future_covariates",
        "feature": "temp_avg",
        "source_kind": "covariate",
        "source_ref": "weather.nwp.air_temperature",
        "watermark": "2026-07-11T11:50:00Z",
        "issued_at": "2026-07-11T11:40:00Z"
      },
      {
        "segment": "future_covariates",
        "feature": "humidity",
        "source_kind": "covariate",
        "source_ref": "weather.nwp.relative_humidity",
        "watermark": "2026-07-11T11:50:00Z",
        "issued_at": "2026-07-11T11:40:00Z"
      },
      {
        "segment": "future_covariates",
        "feature": "rain",
        "source_kind": "covariate",
        "source_ref": "weather.nwp.precipitation",
        "watermark": "2026-07-11T11:50:00Z",
        "issued_at": "2026-07-11T11:40:00Z"
      },
      {
        "segment": "future_covariates",
        "feature": "quarter_hour",
        "source_kind": "calendar",
        "source_ref": "calendar.quarter_hour",
        "watermark": "2026-07-11T12:00:00Z"
      }
    ]
  },
  "options": {
    "kind": "forecast",
    "horizon_steps": 2
  },
  "input_digest": "sha256:f78edd8e74f4f05f8dc79476f19140abfc85107083fd52f9c5ef6e0e05bfa685"
}
